{
  "id": "fixture-2026-10-17",
  "created_at": "2026-10-17T12:00:00.000Z",
  "hardware": "Contract fixture only — not a benchmark",
  "prompt_count": 3,
  "methodology": "Schema fixture only; no performance claim.",
  "verdict": "Fixture",
  "runs": {
    "A": { "mean_ms": 100, "p50_ms": 90, "p95_ms": 140, "ttft_mean_ms": 30, "tokens_per_sec": 20, "swaps": 1, "cache_hit_rate": 0, "total_wall_ms": 300 },
    "B": { "mean_ms": 75, "p50_ms": 70, "p95_ms": 110, "ttft_mean_ms": 20, "tokens_per_sec": 25, "swaps": 1, "cache_hit_rate": 0, "accuracy": 0.85, "total_wall_ms": 220 },
    "C": { "mean_ms": 40, "p50_ms": 20, "p95_ms": 90, "ttft_mean_ms": 12, "tokens_per_sec": 30, "swaps": 1, "cache_hit_rate": 0.5, "accuracy": 0.85, "total_wall_ms": 250 }
  },
  "per_request": [
    {
      "run": "C",
      "prompt_id": "fixture-simple-001",
      "expected_tier": "light",
      "routed_tier": "light",
      "model": "gemma3:4b",
      "latency_ms": 41.2,
      "ttft_ms": 22.1,
      "tokens_per_sec": 38.5,
      "completion_tokens": 9,
      "load_ms": 0,
      "cache": "hit",
      "swap_expected": false
    }
  ],
  "confusion_matrix": { "light": { "light": 1, "code": 0, "heavy": 0 }, "code": { "light": 0, "code": 1, "heavy": 0 }, "heavy": { "light": 0, "code": 0, "heavy": 1 } },
  "kpis": { "KPI-1": 0.85, "fixture": true }
}
